<?xml version="1.0" encoding="UTF-8"?>
<principal-mappings xmlns="http://www.armedia.com/ns/caliente/engine/alfresco-bi" xmlns:xsi="http://www.w3.org/2001/XMLSchema-instance"
	xsi:schemaLocation="http://www.armedia.com/ns/caliente/engine/alfresco-bi platform:/resource/caliente-engine-alfresco-bi/src/main/resources/alfresco-bi.xsd">

	<user>
		<attribute>abc1</attribute>
	</user>
	<group>
		<attribute>abc2</attribute>
	</group>
	<role>
		<attribute>abc3</attribute>
		<attribute>abc4</attribute>
	</role>

</principal-mappings>